{
  "schemaVersion": "4.2.0",
  "apiId": "COMMON.commonfunc.sendtomonitormail-push",
  "newAuthor": "Jimmy",
  "functionCode": "Common",
  "version": "1.0",
  "apiCategory": "CommonFunc",
  "apiName": "SendToMonitorMail_Push",
  "source": {
    "tsdFile": "TSD.Common_封存TSD共用开发链路_v1.0_20260523.docx",
    "workbookFile": "NEWDA_Method_DETAIL_ExchangeCommonFunc_20260522.xlsx",
    "sheetNames": [
      "SendToMonitorMail_Push新版MAIL機制 "
    ]
  },
  "request": [
    {
      "rowKey": "1",
      "fieldName": "mETemplateID",
      "dataType": "string",
      "required": false,
      "description": "樣版檔檔名，可不填",
      "example": "\"mETMnemonic\":\"\"TYPE0_\" + TranType + \".HTML\"\""
    },
    {
      "rowKey": "2",
      "fieldName": "mEReferenceID",
      "dataType": "string",
      "required": true,
      "description": "CUSTID",
      "example": "\"mEReferenceID\":\"123464324\""
    },
    {
      "rowKey": "3",
      "fieldName": "mESubject",
      "dataType": "string",
      "required": true,
      "description": "MAIL標題",
      "example": "\"mESubject\":\"123464324\""
    },
    {
      "rowKey": "4",
      "fieldName": "mEContent",
      "dataType": "string",
      "required": true,
      "description": "MAIL內容",
      "example": "\"mEContent\":\"123464324\""
    },
    {
      "rowKey": "5",
      "fieldName": "mEReceivers",
      "dataType": "string",
      "required": true,
      "description": "收件者EMAIL",
      "example": "\"mEReceivers\":\"123464324\""
    },
    {
      "rowKey": "6",
      "fieldName": "mEParameters",
      "dataType": "string",
      "required": true,
      "description": "MAIL內容參數",
      "example": "\"mEParameters\":\"123464324\""
    },
    {
      "rowKey": "7",
      "fieldName": "mECreator",
      "dataType": "string",
      "required": true,
      "description": "MMAMember 系統_交易類型",
      "example": "\"mECreator\":\"123464324\""
    },
    {
      "rowKey": "8",
      "fieldName": "mETMnemonic",
      "dataType": "string",
      "required": true,
      "description": "收件者ID(身份證 or 統編需補最後一碼需補 0)",
      "example": "\"mETMnemonic\":\"123464324\""
    },
    {
      "rowKey": "9",
      "fieldName": "tranType",
      "dataType": "string",
      "required": false,
      "description": "交易類型",
      "example": "\"tranType\":\"M_CARDLESS_TXN\""
    },
    {
      "rowKey": "10",
      "fieldName": "debitCurr",
      "dataType": "string",
      "required": false,
      "description": "幣別",
      "example": "\"debitCurr\":\"123464324\""
    },
    {
      "rowKey": "11",
      "fieldName": "debitCurrText",
      "dataType": "string",
      "required": false,
      "description": "幣別名稱",
      "example": "\"debitCurrText\":\"123464324\""
    },
    {
      "rowKey": "12",
      "fieldName": "debitAmt",
      "dataType": "string",
      "required": false,
      "description": "金額",
      "example": "\"debitAmt\":\"123464324\""
    },
    {
      "rowKey": "13",
      "fieldName": "pushMsg",
      "dataType": "string",
      "required": false,
      "description": "推送消息內容",
      "example": "\"pushMsg\":\"123464324\""
    }
  ],
  "response": [
    {
      "rowKey": "1",
      "fieldName": "isSuccess",
      "dataType": "boolean",
      "required": true,
      "description": "API成功與否",
      "example": "true",
      "notes": "true ; false"
    },
    {
      "rowKey": "2",
      "fieldName": "responseCode",
      "dataType": "string",
      "required": true,
      "description": "回應代碼",
      "example": "0000",
      "notes": "成功:0000其餘狀況為失敗"
    },
    {
      "rowKey": "3",
      "fieldName": "responseMessage",
      "dataType": "string",
      "required": true,
      "description": "回應訊息",
      "notes": "失敗狀況下回傳錯誤訊息"
    },
    {
      "rowKey": "4",
      "fieldName": "responseDT",
      "dataType": "string",
      "required": true,
      "description": "系統回應時間",
      "notes": "yyyy/MM/dd HH:mm:ss"
    },
    {
      "rowKey": "5",
      "fieldName": "responseData",
      "dataType": "json",
      "required": true,
      "description": "回應資料框",
      "example": "\"responseData\":{}"
    }
  ],
  "mockExamples": [
    {
      "scenario": "推送成功",
      "requestPayload": {
        "mETemplateID": "TYPE0_M_CARDLESS_TXN.HTML",
        "mEReferenceID": "123464324",
        "mESubject": "交易通知",
        "mEContent": "您的交易已完成，金額為123464324。",
        "mEReceivers": "user@example.com",
        "mEParameters": "交易金額=123464324;幣別=TWD",
        "mECreator": "MMAMember_M_CARDLESS_TXN",
        "mETMnemonic": "A1234567890",
        "tranType": "M_CARDLESS_TXN",
        "debitCurr": "TWD",
        "debitCurrText": "新臺幣",
        "debitAmt": "123464324",
        "pushMsg": "您的交易已完成，請查收。"
      },
      "responsePayload": {
        "isSuccess": true,
        "responseCode": "0000",
        "responseMessage": "",
        "responseDT": "2025/06/30 11:20:35",
        "responseData": {}
      }
    },
    {
      "scenario": "推送失敗",
      "responsePayload": {
        "isSuccess": false,
        "responseCode": "9001",
        "responseMessage": "系統繁忙,請稍後再試！",
        "responseDT": "2026/02/24 10:30:25",
        "responseData": {}
      }
    }
  ],
  "backendApis": {
    "DB": [
      "B2C_CUSTOMER"
    ]
  },
  "businessLogic": {
    "steps": [
      {
        "step": 1,
        "title": "初始化參數",
        "details": "1. 判斷tranType參數是否以B2C_開頭，如果是B2C_XID=mEReferenceID;\n2.mEReferenceID進行格式化處理，補足11位，Common.getCustIDFormat(MEReferenceID);\n3. 定義bSendMail是否可以發送的變量，默認為false\n4.定義TWTranType變量，存放交易類型描述"
      },
      {
        "step": 2,
        "title": ": 判斷tranType",
        "details": "如果（TranType=\"M_PAYEEEMAIL\" 或 TranType=\"MMA_PAYEEEMAIL\" 或 TranType=\"MMA_REMIT\")\n並且MEParameters.IndexOf(\"交易已受理\") > -1))\nbSendMail=true；"
      },
      {
        "step": 2,
        "title": "依交易區分PUSH提示（需要進行推播的組合參數進行推播）",